{
  "schema_version": 1,
  "message_id": "bin-001-00000001-00000007",
  "device_id": "bin-001",
  "gateway_id": "gw-001",
  "boot_id": 1,
  "seq": 7,
  "node_uptime_s": 361,
  "sample_age_at_rx_s": 0,
  "reason": "periodic",
  "quality": "ok",
  "distance_mm": 775,
  "fill_pct": 25.0,
  "battery_mv": null,
  "alarm_active": false,
  "lid_open": null,
  "valid_samples": 7,
  "config_rev": 1,
  "dropped_reports": 0,
  "node_fw": "1.0.0",
  "gateway_fw": "1.0.0",
  "rssi_dbm": -82,
  "snr_db": 7.5,
  "gateway_boot_id": 1,
  "gateway_rx_uptime_ms": 365000,
  "gateway_received_at_ms": null,
  "sampled_at_ms": null,
  "time_quality": "unsynced"
}
