{
  "schema_version": 1,
  "message_id": "bin-001-00000001-00000004",
  "device_id": "bin-001",
  "gateway_id": "gw-001",
  "boot_id": 1,
  "seq": 4,
  "node_uptime_s": 181,
  "sample_age_at_rx_s": 0,
  "reason": "sensor_fault",
  "quality": "timeout",
  "distance_mm": null,
  "fill_pct": null,
  "battery_mv": null,
  "alarm_active": true,
  "lid_open": null,
  "valid_samples": 0,
  "config_rev": 1,
  "dropped_reports": 0,
  "node_fw": "1.0.0",
  "gateway_fw": "1.0.0",
  "rssi_dbm": -82,
  "snr_db": 7.5,
  "gateway_boot_id": 1,
  "gateway_rx_uptime_ms": 185000,
  "gateway_received_at_ms": 1791478980000,
  "sampled_at_ms": 1791478980000,
  "time_quality": "gateway_estimated"
}
